,news,label
2769,and added FTW returns with one more competition Win Academy a kind of captacao tournaments to discover new talents for competing team will be played FIFA in PlayStation version and sera,sports
1191,infrastructures to be able to interrupt botnet activity but warns that you can do temporarily once glupteba uses blockchain technology as a mechanism to avoid a comp,tech
2586,"One more return from one of the oldest combat series the prices of electronic communications in general Portugal are ""relatively high"" context of EU European Union and there are ""problems of",tech
401,and Tottenham from England for 1 0 this was second passage from Jorge Simao for the North Club after having oriented Club of the Capital Mobile in 2015 16 Early in which he managed seventh place championship,sports
1816,Es executives take place from that and greater remodeling from simplifying their structure and focusing on Samsung logic chips that through the Galaxy brand helped company make it higher,tech
448,illa and leeds respectively wolverhamtpon that still counted on Daniel Podence and Trincao in the final moments encounter added fourth consecutive departure without winning occupying eighth position with points,sports
851,omissos and ja de december that Matrix Resurrections will arrive movie theaters in Portugal symbolizing continuation of the cinematographic saga that brings together the protagonists Keanu Reeves and Carrie Anne Moss,tech
825,t lake 10 and the comet lake 8 here are the best online games without any commitment to play when bored challenge and that it is playing against other players some of which more co,tech
2711,"Ms been targeted by his contribution to journalism ""Jose Maria Neves recalled that on Thursday he was at a ceremony that marked the days of activism by the end of violence against women and defended",general
1852,Cidencia and with three games closed door sporting president of the covilla Jose Mendes assumed today a single mandate in the elections Clube da II Soccer League marked for December because,sports
3250,"Enter ten years and balancing could not be more positive Vera Pinto Pereira ""EDP volunteer strategy to reinforcing Importance Program for Prosecution of Social Investment Objectives",general
564,onwards second Cabec Tournament and current 207 placed from the Hierarchy ATP Nuno Borges 228 won first partial for 6 4 but had to apply next which came victorious by 7 6 7 4 after Le,sports
409,game of 14 journey of the soccer league in which he entered practically losing when he suffered goal soon in the seconds Fulham trained by the portuguese Marco Silva has given fourth consecutive tie in the second L,sports
1109,ARA Cipher and same that is used to decipher asetricane encryption asymmetric encryption and also known for key encryption publishes basic encryption and helping,tech
3061,EIRO MINISTER who closed session of opening Manuel Machado said that it is imperative to avancia for a new autarchic financing regime and a permanent monitoring model of decentralizes,general
1480,"Hashtags' most commonly used on platforms such as national Instagram accounts that most grown also spoken was confinement after year to be met with ""a new peak cases of covid infection",tech
2884,"nseiam for an absolute majority that ps already asked or then lack of it for such a saying central block block of the business and interests that psd already guaranteed ""stressed"" in 2019 custured look for future ""af",general
2674,essential windows all measures that can make chrome faster are welcome and help users surf the Internet despite the podcasts are products that are consumed mainly through,tech
1654,We created this team a team with a winning spirit with a lot of humility and desire to work Direction Flamengo continues looking for a new coach and there are two names that were recently RISC,sports
1355,It was surely approved said Costa considered that decentralization and a challenging exercise and highlighted his will that process runs well by Portugal and the citizens Antonio Costa underlined in,general
1052,Ends have a mobile version and already made advertisement and have in the Google Play store a teaser with possibility of registration for the Bettle Closed Version test of Battle Royale allows players to participate and,tech
1733,For a few years that is good for the central block and block of interests if they briefly join this and current situation of Joao Locairo according to national director of PJ Luis Neves and,general
296,Sportiva da Lyon Business School Hamilton and Mr. 2021 Hamilton is in transition to a kind of social entrepreneurial social influencer compared a plus flat personality with,sports
1540,"competence, however, considering that Camera presidents still deserve more responsibilities that concerns transfer of expensive competence colleagues let us say one thing here",general
466,Separation 11 Saturday and Rival Benfica Third Visit Famalicao 14 Sunday FC Porto seek to maintain good internal campaign Extreme nemane Radonjic will fail Benfica meeting in Famalicao scheduled for this,sports
2378,Through Instagram After draw with Bodo Glimt 1 1 result that helped Rome get direct clearance to the octaves of League League Conference Europe Thanks for your honesty in trying to,sports
2398,"We want employees to have equal experiences and access opportunities for growth and development, the last year showed that our employees are dedicated and committed independende",general
307,Ting about Boavista who left Condition The isolated lions of the League Classification 2021 22 fills this Sunday first pages of the three sports dialys of the National Writing Press that,sports
824,COS created by the user Reddit Ingebor based on the information of the German store referring to the month of November the CPUs Alder Lake debuted if in Germany with 11 participation surpassing the Rocke,tech
2656,"Startups Environment of Business Inovation Management Capacities and Engagement Modes ""Taina Fonseca of Brazilian nationality has been distinguished in the category of technology and natural sciences with a",general
1583,Tunisia rounting on Wednesday while qatar also with place guaranteed at this stage is waiting for the winner of today's match between Morocco and Algerimo Maritimo received and won today Santa Clara,sports
217,'Winning at Athletic Madrid Real Madrid Leads with points 16 games followed Seville with 16 Betis with 16 Atletico Madrid with 15 and Real Sociedad with 16 Noruguese Jakob Ingebrigtsen,sports
2350,AIS searches for Google in 2021 concerns around Covid 19 maintained whether but many pre pandemic activities have returned to be part of the Portuguese's life soon from their Google searches << Tendenc,general
1578,and - it was put once again proof return was so deeply marked by everything that we live together until here but not a return normality because we are all different changes introduced,general
308,"Machine """" Who knows well are the players 'Jorge Jesus """" FC Porto' Ha a glaring inequality 'Carvalhal highlights the two days less resting than the dragoes """" P' I'm not used to hand",sports
2713,hip for children and parents in the messages as well as other characteristics and corrections of failures for your iPhone first Vista Heroes Dark reminds very environment of Castlevania even because even drinks,tech
1179,This rapporteur helps sustain creation of this team so that organizations adapt this new reality so do not lose clients The new Visa consulting services must be borne in,tech
1428,Menez stressed Alexandre Parents Lusa we opted for those artists who worked tile and also three-dimensional ceramica but we were careful to try to choose almost archetypes joao rendeiro,general
2136,"ol congratulated Jose Manuel Francisco for Vitoria in the elections for the social organs of the Reboleir Club waiting for it to be ""a time of turning"" ""star of Amadora Sad Congratulation Jose Manuel Fra",sports
3189,"Anticipated legislation next year for former presidential candidate ""liberal proposal is consolidated as an alternative to the current system"" a path that was possible from funding ""but pair",general
1112,"For a new adventure of Action in this world of fiction scientific a history that intends to be Epica following Halo and Halo Guardians hook events can still be used to ""steal"" the vehicles of the",tech
247,L Never had passed from the end rooms immediately afterwards GP of Abu Dhabi who finished with Verstappen in front of Hamilton and celebrating achievement World title of Mercedes Pilots presented,sports
1333,"reveals importance of continuing with structural investments and reforms that will ""improve life conditions strengthen public finances and favor a sustainable growth trajectory for",general
1269,"tulou with an agreement reached between council and parliament around its proposal for revision 'roaming' ""we think that is a really meaningful moment for tiktok bet passes by an even",tech
2244,Windows and Office Always Evening Malicious KMSpico Activator Official Lanyards You can steal your cryptomoedasha,tech
3243,Dir Polarization of X-rays in spatial objects with high levels of energy counting for such with three telescopes with state-of-the-art technology Thomas Zurbuchen NASA scientific administrator,tech
467,Sunday 18 hours for still being recovered from muscle lesao second newspaper ball of this Saturday player of years is still not recovered from the LESAO in the right thigh suffered at the receiving to the Pacos de Ferreir,sports
2232,"stocked over when he should enter Portugal National Director of PJ stated that ""this and a subject that now competes judicial authorities of the Republic of South Africa"" Joao Locairo who in September",general
392,Leased Sunday Visit Burnley Premier League Podio Follow Manchester City 38 Liverpool 37 and Chelsea 36 How As RED Devils' have consisted of the respective penalty triumphs,sports
1510,"Lime with many users still and when Europa ONE UI reaches the Galaxy z fold3 and z flip3 should be perfect association of portugal hospitality AHP says that already ""was not no time"" public",tech
39,International Portuguese Sheriff and a team that comes from the League of the Champions where he makes seven points put Shakhtar Donetsk behind them and with a victory at Real Madrid home by 2 1 Carlos Carvalhal Co,sports
3371,"A on Monday """" Exams confirmed that there is no neurological damage ""can read if in the Note of the Belgian formation on cyclist status of years Vansevennant by his side left one of the thumbs and return",sports
1022,Stavel and ready to be used since there were no problems in testing problems in the Galaxy Z fold3 and Z Flip3esse Process has now been put into pause Various reports of problems with many ICU,tech
1791,Higher transmission city that delta variant that is still remaining dominant or palms and palmadines in the back of Joao Cotrim de Figueiredo became first day of VI convention,general
1862,Alde Jornal Pintcha won in the press category with smaller personal report with salary delay in the Public Schools Filomena Alfredo Sami of the national diffusion radio was awarded in the category,general
496,IPAIS adversarios national champion only enter the field Sunday with the 'lions' try to enter win to put pressure on the rivals game this scheduled for 18 00 stadium afonso henriques and to be,sports
892,Giant Technological Umores plans to also explore development of an automobile with a more futuristic design including interactive displays for years that pantone chooses color year that influences develops,tech
3439,of the Municipal Barbara Xavier's leftist block of the guard welcomed whether by taking positioning municipal executive of the guard in relation to the preliminary environmental environmental evaluation report,general
3572,Rios Angola Brasil Cape Verde Guine Bissau Guine Equatorial Mocambique Portugal Sao Tome and Principe and East Timor are the nine member states of the CPLP organization that this year celebrates years Erib fees,general
770,Scientists decided to empty the oceans to realize that it under the water based Etopo1 1 ARC Minute Global Relief Model that integrates terrestrial topography and oceans and global fo cover,tech
492,"and demanding route will be a great challenge ""Portugal has a good homogeneous team that is good because if we can end a lot together we can get a good collective classification and can surpass ex",sports
2191,"less mediatics to overcome difficulties resulting from the lack of means and combat conditions of combat economic and financial and corruption crime ""pointed parliamentary leader of the Communist Bench OBJ",general
2770,S Measures to address subject Ja in 2019 Institute of the Public Markets Impairment and Construction has created a dedicated unit implementing controls to develop supervision programs,general
1151,Recently identified as 'key factors' in the formation and maturation of neuronal circuits therefore dysfunction of the astrocytes resulting from Mutacao Gene Shank3 can take problems in formation and mat,tech
1272,ara windows so give a simple and clear answer this dilemma in some cases can read if an inconclusive message where company informs still not having information available for that game or,tech
195,"movement alleges of Mercedes this way this confirmed first career of Max Verstappen's career who said he has fulfilled ""a child's dream"" goal Darwin 6m 0 1Passe de Rafa to Darwin Remate",sports
2590,revealed that Amazon was fined in 1 13 thousand million euros for domain abuse market in turn Amazon says he vehemently disagrees against the decision of the Italian regulatory authority and in addition,tech
1435,"What in September was sentenced three years and six months of effective prison in a process by qualified burla crimes was foreign and partly fleeted justicated with ""litigation"" p",general
712,BERTAS on all associated device account 4 finishing sessions telegram automatically from the most interesting options that this area offers and automated management of session tele,tech
1267,week but a gallery with some of the best photographs registered in the last seven days in the different sports modalities of the Portuguese clubs in the European tests are highlighted D,sports
1697,"It is good that this compromise had no climate or biodiversity crisis ""plantation of new trees is not an alternative preservation of existing trees but a complement an ACA",general
95,RIM at 08 09 or Marco Games of the Oithos Final of ChampionsBenfica Real Madridvarreal Manchester Cityatletico de Madrid Bayern Muniquesalzburg Liverpoolinter of Milao Ajaxsporting Juventusche,sports
647,"AIXA of the GHz ""and this is one of which integrates set of pioneering bands for the development of the fifth generation networks"" in these terms completed Leilao 5G and other relevant bands 700 MHz M",tech
241,Chester United 27 and Arsenal 26 fifth and sixth placed respectively Ja Burnley that has a delayed game follows in despromocao zone 18 post with points one more that penultimate 'new ri,sports
793,and carbonism more that this mentioned that it is a priority that transport becomes more green including the railways about modernization of domestic energy Minister of Hungary mentioned a,tech
884,NTO Follow Lancamento Patch Development Team Launched an article Blog game where you addressed enhancements Included if you want to report some problem with game can use this link and follow in,tech
1566,International Portuguese left a thank you Ruben Amorim and Frederico balconies Mister Ruben Amorim has known to always withdraw better from me and also grate him and to President Frederico balconies,sports
2639,and about herncas in practice such means increasing municipal tax on IMI and successor tax that was abolished in Portugal in 2004 In addition to taxes on organization property says,general
682,efficiency brands that other influencers hopes if that model galaxy s22 ultra in addition to support interaction with pen still brings a coupled to the opposite that happened with s21 ultra ha much that we,tech
192,"Five minutes later, Venancio matches Caala recreational departure 13 The great race commissaries of Abu Dhabi in Formula did not give reason to the sequence of protests presented F",sports
3626,"The ""concluded this agreement was signed to"" avoid additional distills to the athletes seeking their dreams in this sport ""said still interrupted Serie de Vitorias in all competing",sports
134,To now with 34 program and results of the 14th Journey Friday ten Pacos de Ferreira - Gil Vicente 0 1 Sporting - Boavista 2 0 A goal pointed by Defense Pape Cisse gave today Vitoria to Olympiacos,sports
2170,to know much more about history of any furniture of Apple and Gamer and this search for a social network where you can meet other noto players is designed for you and promises help you,tech
968,SA that is highlighted in the area of supplementation but also has several quality technological products and even dressing today our suggestion goes to score a cardiac monitor sensor with band,tech
2852,Well referred to as quality of life in the companies of life quality laborOPlos motives presented companies perceive if more and more of the importance of the quality of life work and the,general
2669,"way to grow the extremes system ""for Coolim Figueiredo"" if there is something I think is necessary to have now beginning of 2022 ""at the time of legislative elections of January"" and clarity in",general
2618,"Children climate change poverty and social inequalities ""on this International Day of UNICEF UNICEF DIFFERENCE OF NATIONAL ACAO and International Cooperation in the Defense of Geracoe Rights",general
1547,Greeting cards in stores where they store them in closed boxes after many requests and several discussions around theme related to the technical opinion to vaccinate children DGS published technical position,tech
2267,Duzido by a PS with free hands does not start dead and with Rui River Trailer works in a marching after workers' rights in the SNS and the school publishes in the value of the,general
239,Azes to mark any goal turf moor and tell only one victory in the last five rounds of the Premier League in which it has been losing land for Lider Manchester City 38 points and for the 'persecution,sports
2542,"The conjugation of this work has been important for conditions of athletes and for sports development image and valuation of athletes ""referred Luis Benfica management is in the",sports
2845,EMU has lived with him to be missing the true friendship and good disposition of the Halo Saga Fas awaited from Master Chief's return to a new adventure of Action in this world of scientific fiction,tech
2698,Bankers and frameworks for president BES According to Avanca Express newspaper paid access According to newspaper this execution aims to obtain goods to pay a fine imposed by Banco de Portugal in a contraordin,general
3084,Ausa of the wounds but we believe that they have been the confrontations after the Ukrainian fans have caused decanting before Benfica and Dinamo de Kiev in the immediate stage of light confu,sports
1487,Cerem as a planet the results work involved an international astronomers team were now published in the digital edition of the scientific journal Nature Portugal and one of the Member States,tech
1473,"Survey execution was hired A ship capable of operating in deep water safely with a high technical capacity and Ultima Geracao Technology Portugal has ""Space to reinforce",general
883,Years patch 3 1 already arrived last day of December and brought with several corrections so today being last day of December was launched patch 3 1 which brings several improvements and correcoes to the game,tech
1329,Omphere on that river that borders between Portugal and Spain from people from Algarve Algarve Sanlucar from Guadiana Huelva and Foz in Vila Real de Santo Antonio Ayamonte in Operations Coordinates PE,general
3188,usually due a small problem in my lungs I will maintain my physical form and hope to return full time in January said Joshua Kimmich in a statement released by Bayern Munich Final,sports
2759,Pio has been pressured by Banco de Portugal to solve his problem with problematic assets Banco Montepio arrived September with a NPE Non Performing Exposures of 9 3 one of the highest,general
3561,"Potential Boot Sunday December or Monday December ""advanced in WSL statement pointing to a 'swell' big wavy and favorable winds that Dao organization"" Great Convianca """,sports
1423,and 5 3 wings Bruno Coelho Napoli Futsal ITA Mario Freitas ad Fundao Miguel Angelo Sporting Pauleta Sporting and Tiago Brito Sporting de Braga Aaum Postal Cardinal Sporting and Zicky Sporting The First Fu,sports
113,Ininda to defeat SC Braga and arrived moment when it plays more asked Rafa Silva added yesterday more three passes for goal and became a player with more assistings Portuguese championship player,sports
778,Rohm Haas DuPont from DuPont that would be invalidated according to Bloomberg Site the international trade commission lawyers can agree to the request of Intel of a period of CARENCIA DE MES,tech
2268,It was not realized because Venezuelan authorities have not yet regarded any response and the requests we have made to allow those flights said Carlos de Sousa Amaro also,general
2351,Shareholder of Portuguese Electric with more than 19 Capital VAO Update the terms of the strategic partnership according to a statement sent Est Friday Commission Committee Market Furniture CMV,general
3224,sit in a collaborative consortium regime between Ministry of National Defense - Navy and Company Ricardo Barbosa Lda Which Navy assumes role of Lideranca Consortio Northern Project told And,tech
950,"RGE currently well positioned in the main 'international rankings of the area ""A"" difficulty in various network devices ""from Amazon Web Services AWS Virginia data center in USA",tech
3514,with European agency environmentally applications << MAPMYTREE >> According to European Commission can be recorded on the trees platform that benefit biodiversity and climate and that are ADI,general
1009,very large importance before that in the next few days Microsoft should also launch an update for teams that will prevent this problem from arising future even if it is not a common situation once,tech
2907,"I exist a story that you want to be Epica following the events of Halo and Halo Guardians Hook can still be used to ""steal"" the vehicles of enemies distance projecting if and pushing them to f",tech
2273,Umentou 29 6 Among the first and second quadrimester Eset leaves some tips for safeguarding fraudulent schemes around the greeting cards first should only buy these,tech
2606,more possession but when ball is in our possession let's make our game noted Claudio Ramos and Francisco Conceicao last conditioned today they integrated training FC Porto preparing and,sports
1075,Throughout Europe that in any previous week in the history of the console the titles made themselves rapidly sold in Franca Germany and low countries Note of drafting Sapo Tek contacted Ninten,tech
3544,Velacao Brand Launched a New Trailer In a publication Official Blog of the manufacturer Pete Lau Chief Product Officer of OPPO and CEO of Oneplus states that Smartphone and the result of four years of investigation,tech
2451,"If in an opinion of the medical counselors ""putting priority in the health of players and technical teams"" without a new date for meeting Tottenham that started with the Portuguese technician Nuno",sports
474,Tar until December a defeat in the secretariat dictara elimination Club London in League Conference Europe Meeting between FC Porto and SC Braga Scheduled for this Sunday 20h30 Sergio Conceicao will arrive,sports
400,S Six triumphs in official meetings for all competitions Between Liga Two Tacks of Portugal and the League One in every competition and alloy Europe Conference Thunderstorms Highlighted Triunfo Dian,sports
495,more experienced of the champions but players know second test sporting enters the journey with points the same leader FC port and four more than benfica team that hit the previous journey,sports
2909,from more than 267 88 million infections by the new coronavirus registered since the beginning of the pandemic second most recent balance of agency france Presse XXV Congress of the National Association of Munic,general
324,I tie with 2 2 final extension decision stayed for the penalties in which Algeria was more competent when converting the five maximos punishments while Moroccan selection failed room by Avancad,sports
3413,for their users new final version oxygenos 12 truth and that reactions of users were nothing positive and many were not pleased with this version now oneplus came public reports,tech
2822,"In viewing falsified identification document and another by usurpacao and or use of usurped work, it is the foregoing food security authority and economic ASAE in a statement today",general
1541,"SSistiu an activity of ""significant coordinated and malicious volume"" that led ""several errors"" in the application of the new political policy entered into force on the last Tuesday and forbids sharing",tech
2667,2 Add Apple Music Voice Plan a New Subscription Level Music Access Using Siri This update also includes a privacy report for new security applications,tech
2570,MGene Pharma Company owner of OPFC Clinica Medical port of nursing medical services and complementary examinations of diagnosis and clinical analyzes of OK Pharma specializes in and C,general
69,General Games SL Benfica Games FC Porto Games Sporting Cppode Also receive notifications of the goals of any game that interests you on page Even Attorney Edwige Roux Morizot referred to that Yannick,sports
