,news,label
1016,Bank Bank that will keep digitally agreement with revolution bank information will not have physical balcions keeping digital presence in an inquerito made customers in Portugal verified if that 56 would be D,tech
2182,"For UNICEF UNICEF refugees and World Health OMS organization ""The deadlines for a situation for situating are not clear"" advanced Belarusian red cross justifying the need to continue",general
751,Not to please Germany or Canada or Mexico that they consider them unfair competition as it referred Ola Kallenius President of Daimler in conversation with Financial Times rules should be,tech
23,was holder and aligned the minutes at Vitoria Benfica on the visit to Famalicao 4 1 in match disputed Sunday rpclusa END does not lose usual heading of the ups and downs of the week nor the prognosis,sports
1934,"Veis ""Living"" Prisoners of your mobile ""for Pope Currently many young people"" are on social networks but they are not very sociabable closed in themselves telemovel prisoners who have in Maos",tech
2519,Santander strategery still offered a senior position to the banker but Orcel refused supply and in response Processed Spanish Bank for Breaking Contract The Ministries of Finance and,general
569,"M these mistakes not to repeat them ""concluded Norwegian Magnus Carlsen conserved today title of champion world of chess while beating Dubai a fourth game Ante Russian Ian Nepomniachtchi who challenged without",sports
2165,"Ustria grew up in terms Homologists 11 6 In October after a rise of 11 7 in September according to data released this Friday by the National Institute of Statistics INE according to ""Volu's Index",general
3337,R Sizun when woman put a poster intended for grandparents right in front of the head group causing a fall of dozens of cyclists rolling high speed incident caused many color lesoes,sports
1408,Because several companies have been authorized to make a flight flights at Natal and Madrid in Caracas and Madrid in the sequence of several appeals so that Australian Government intervene against J,general
794,Ma Government that supports development of heating systems Find here of the best prices for digital keys for Windows 10 Office and many games with great discount then will be POS,tech
1437,Technician Bayern Munich revealed that in was approached by Real Madrid to succeed Zinedine Zidane in an interview Sports Illustrated Germanic coach that at the height oriented Hoffenheim explained P,sports
1723,je coach julian nagelsmann medio joshua kimmich that was not vaccinated and tested positive to the new coronavirus final november finished quarantine this week but had not play again until 2022 because,sports
3664,M Place in the final of the category While Nuno Vitorino was second 'Heat' of the second round behind Costa Rican Mathius Vanderhoogth but with Somatorio of the points of the first round secured a place in the,sports
2503,Je to 0 543 plus 0 003 points against current minimum of always from 0 546 Verified in December three months Euribor went down to a new minimum of always when being fixed at 0 588 minus 0 003 points that n,general
1060,be the smartphones in general telephone as we know and an artifact dictated by the beginning technology of the 2000s teacher states that the smartphones currently interact with everything our,tech
1712,"Habitation communicated Ministry of Pedro Nuno Santos ""thanks dedication and work of huge quality that Antonio Orange led Cape in the presidency of IP"" emphasizing that he led a company ""in a perio",general
3334,It is difficult to find available market for more than this to increase production COLETTE KRESS says that NVIDIA has assumed long-term commitments for its production capacity then 12 or,tech
3549,Ecient adversaries in the eighth of the UCL Podcast tells Mario Cagica Joao Rodrigues and Joao Pedro Oca as resident commentators and today our guest was Francisco Sousa from Eleven Sports,sports
3049,Ma as you dealt with dismissal of the officials if this call is part of a unlucky group that will be fired said Vishal Garg executive director of Better with videoconferencia with the work,general
3386,"always look and create problems inside ""the parties are anyway I prefer to look out look at the problems of people and so I get very happy to start today",general
3491,to the ninth place now with points as Santa Clara keeps themselves in the lower area of the table being 16 << with points I will remember today as one of the moments of greater pride of my life I am deep,sports
2332,Hou Dutch Max Verstappen Red Bull Command Championship that will be decided in the last proof year in Abu Dhabi for decisive race Mercedes This analyze possibility of putting new engines in the CA,sports
488,with good eyes a foreign coach commanding the destinations of the selection canarinha parents who raised taca de champion world in football for five times ha more and more foreign coaches here,sports
129,"Ck 'and incarnates rock in Famalicao """" FC Porto SP Braga 1 0 Diaz of always Colombian solves again """" Sporting Sarabia decisive as nobody and lion with more goals and assistances """" Formula 1",sports
2973,Cases Asia 910 765 Mortes 57 729 621 Cases United States and Canada 824 511 Mortes 51 486 390 Cases Africa 224 420 Mortes 8 878 949 Cases Medio Orient 216 334 Mortes 14 443 559 Cases and Oceania 3 416,general
2333,IL has entered the last time in the orbital stake ship will coupled in the pok module of the ERA of Russia after completing four orbits and six hours of flight flight there are also pounds of cargo between MATERIAI,tech
269,Portuguese Mariana Machado said today that she could not be happier with third place in sub 23 in the Europeans of Corte Mato in a test in which she thought about the medal after making a second training late,sports
3425,"Guard Networks for a large part your effective if you meet sick or quarantine or that is considered ""Responsible for the not realization of a game"" UEFA announced in the morning of Thursday postponement",sports
3758,o Indicating a horizontal use official announcement is pointed to February next year eventually with Galaxy S22 Next unpacked measures against Cuvid 19 for this Earth Natalicia J,tech
1639,EMAS but those that existed were significant and with impact on this deco system criticizes precisure increase as well as the sale of identifiers to be discontinued new prices of the Verde Verde,tech
2692,Must be moderate now measure that chip production stabilizes and that manufacturers averted pressure on the most profitable models percentage of Portuguese companies with Internet access that use,tech
1085,SSADO already case of packages 4 5P monthly media of spending was 43 11 euros and 3p was 27 59 euros Meo and operator with the highest quota of subscribers of these package services with 40 8 following whether,tech
2254,"was that brand visibility contributed to ""break tabu that still exists in many countries about sexuality and this industry"" instead of ice logos can read if hashtag ""equalityforall""",sports
82,Esmo for Europa SC Braga faces the moldavos Sheriff Play access to the final oaths set of Carlos Carvalhal Second Group F behind Red Star that qualified directly to the,sports
705,the December to a trailer the details about new equipment are still relatively scarce but the rumors already circulate online and now there are new images that unravel some more details,tech
3288,PCAO to pick up results and share it with world through twitter or then download the record image if new matrix resurrections also gave rise to a new free interactive experience,tech
63,Inter Milan in its European History Sheriff Never Front Sporting of Braga or any other team Lusa Seville King of the Europa League measures for Dinamo Zagreb while Olympiacos trained by P,sports
3235,or until the years but from here five I still have intenctions of being training creased declarations of ricardo soares coach gil vicente after triumph about pacos de ferreira 1 0 stadium capital moves,sports
483,"CUPAR If with the sick and so they wrote manual that he said ""will be very useful"" Pep Guardiola Coach Manchester City asked the players to prevent themselves during Christmas celebrations with friend",sports
3182,OM International Portugues Adrien Silva 'eleven' guaranteed the three grate points a 'bis' advanced Gabbiadini to and minutes and another by the middle marked by Francesco Caputo 49 in the final stretch Challenge,sports
847,Heard Tariff in the Kids As a name suggests and a tariff for the newest who has been launched in 2018 This tariff has made it quickly in one of the favorites of the families in the designed and adapt,tech
1413,"Xcante ""Consider Waterworth 'Social Shopping' will be a great prize for this segment Vatican Tiktok director removes all barriers ... we do not see how to buy and part of a conversation with al",tech
737,new ema in the courts price of fuels will come back up ja tomorrow since beginning of november that prices did not know and now climb will be significant fuel gasoline will rise c,tech
2430,"ICIA JUDICE PJ that concerns the detention of Joao Localiro when he considers that authority fulfilled ""exemplarily his mission"" ""PJ showed a great proficiency fulfilling his mission MI",general
363,via zoom in a maximum of five meters we try to disassemble game if the players are ready to make a long pass we had to work the players also mental level make them believe that I,sports
2626,"Savel considered a series of tornadoes as ""most mortal"" of Kentucky Story Total Number in the United States now and at least 93 American Northern Socorro Teams continued today",general
1961,Droid for smartphones that Xiaomi will now leave off Miui 13 to spend these days of rain and cold comfort your sofa we leave a selection of Christmas movies on Netflix to enter spirit d,tech
2944,the least spoken if it is badly spoken all the time is not always like this until the day that returns if you come back jonas with good eyes a foreign coach command the destinations of selection canarinha,sports
597,Error echoes Support for privacy reporting of applicants for access data access and sensors Resolucao of a problem that could cause notifiers to interrupt inesperadament,tech
644,Ucao was placed on Real Nails from December Meta was contacted by the New York Times that questioned the account of the account has been disabled to which he replied that account had been removed incorrect,tech
2454,TODOLOGY AND DEVELOPMENT IN THE ASSOCIATION ARGENTINE FOOTBALL AFA will guide selection Sub 20 start from January 2022 today announced that body according to ancient afar average defensive and defense today co,sports
1903,"MARKING MARKING MARKING MARKET OF ASTICKS Adding regulating Dimension of each operator presence sector to assets that manage and investors with which they work CMVM wants to ""foster competitiveness and develop",general
1832,"and meeting ""was suspended by the arbitration team that considered that club of the house did not secure insurance conditions necessary pavilhao Salvador Machado in Oliveira de Azemeis"" Confirmed if he",sports
774,some of the things that should not share to stay with more professional profile and to point out that throughout this item will be given advice data that does not share in your account Linke,tech
1163,Four years later negotiators Council Member States and European Parliament arrived today to extend for free of itinerancia or 'roaming' services in the European Union for more years,tech
1236,not divided where users have their digital technology rights saved lives allowing millions of people to continue to work and socialize with security line increase of utili,tech
3715,"AM referred to the Constitutional Court that pointed out two notes ""first was that in general our statutory text our internal legal soluctions have fulfilled with the law of political parties to",general
214,ra mark in minutes by Nico but two minutes volved David Garcia re-established tie for Pamplona's team that was recorded at the interval in the second part FC Barcelona returned advance,sports
1807,possibilities disposition of who uses social network to make messages changed into conversations at the end of some time passes now also be possible to predefine service to erase messages,tech
3177,points but less a date while Estoril Beach occupies fifth table position with 21 due to the outbreak Coronavirus Sars Cov 2 who hit coaching players and elements of the BELENE Club,sports
2754,After a certain period of time while starting a new conversation has new feature options was launched in November last year but it was only available for new private conversations and uses them,tech
874,RDA with placement of surveillance cameras in public places like this in our question this week we want to tell us to agree with placement of surveillance cameras in public locations and,tech
3280,"that your team is ""99"" to visit Vitoria de Guimaraes at a game of 14 soccer alloy journey after being in isolation due because Cuvid 19 ""The workouts were very intense with a lot of ritm",sports
891,"Remember If Focus Change ""Project Titan"" of Apple states as one of the biggest changes to the project of the company that has been going through several alterations since 2014 according to new R",tech
2867,and suspected was detained and present judicial interrogation having been decreed measure of most serious coating of prisao preventive SIC news according to a note sent social communication,general
528,Great ABU Dhabi prize of Sunday formula will enter history as that gave an eighth title title to Britanico Lewis Hamilton Mercedes or the Dutch Max Verstappen Red Bull,sports
1259,"assay could be dismissed from the first two payments valuation of the lower remunerations of the public officials ""and something that will have to be done in a nearby government"" due compression",general
64,Ortegues Pedro Martins faces Atalanta and Leipzig de Andre Silva and adversario da Real Sociedad The other embates put Front Front Zenit to the Betis of William Carvalho and Borussia Dortmund de Raphae,sports
1974,TOS for 49 884 588 Cases according to count at Johns Hopkins University Europe totaled until today 11 00 1 570 241 Mortes and 88 928 884 Cases America Latin and Caraibas 1 548 058 Mortes 46 942 832,general
2235,To zero emissions mobility is to make advantages of electronic vehicles in comparison with internal combustion engines in England and Wales,tech
1210,higher for your users clear that Facebook and others quickly showed up with rules having advanced now knows if even with these rules and protective apps with snapchat,tech
1092,Time that until the end Year Apple Application Store Gains revenues from 85 1 thousand million dollars the same calculations for Play Store point a provable recipe in the order of 47 thousand million Dolare,tech
2913,ingiated the 85 but Minister of Modernization State and Public Administration also expects that with execution Plan for Recovery and Resilience PRR Simplex Receive a huge boost since February program,tech
2246,of 50 000 new infections registered every day in London Omicron represents a trek of cases of Cuvid 19 Ja Ancient daughter President Isabel dos Santos was forbidden to enter the USA Washington,general
3362,"Portuguese Ederacao of Mountaineering and Caravanism FPMC Joao Queiroz received this proposal ""with a lot of hope"" inclusion of climbing skateboarding and surfing Based if explained Thomas Bach ""in Contributo Signifi",sports
2206,With 24 large ABU Dhabi prize of Sunday Formula will enter history as that gave an eighth title title to Britanico Lewis Hamilton Mercedes or the Dutch Max Verstappen Red,sports
3203,"and technical team and club structure enhancing importance of maintaining a strong connection to the fans ""we are aware that and feirense we know of their demand and their fans and went with this pillar that",sports
1854,"A Code of Conduct for Members and new rules relating in particular for the financing of political activity but stresses that ""still lacking an efficient supervision mechanism""",general
2933,levels about 1 2 million euros to invest payment of tips until end year program ISA FJN guarantees full payment of tip and investment and refunded if and when student reaches,general
3256,Actou Galp on Impact of this Administrator Mandate Costa Pina but company did not want to make any comment on Banco Santander's subject was convicted of a court in Madrid to pay 67 8,general
643,r pretend to be another person your company metaverse makeovers created a lot before pokemon go or the snapchat filters and instagram holograms jump nails when a mobile phone with your application in exec,tech
2947,"Joggles to Santa Clara on the 14th Journey of the Soccer League supporting initiative Solidaria de an adept titled 'A special Christmas' reported today Club ""Maritimo will exchange tickets for",sports
180,ONA continues with two goals striped Osasuna who shoots for an amazing eighth place with rival points and Lider Real Madrid are already known initial teams of FC Porto and SC Braga for Duel,sports
2095,In the meant to say new generations to tell them do not make us that we did Portugal continue to support Angola in the fight against pandemic and two days after last DeCao delivered through Covax Mechanism,general
187,Victory Inter can exceed rival and Lider AC Milan that counts points after tie a goal with Udinese Lazio departed to Duel with Sassuolo with a chance to touch whether Juventus on Friday Position,sports
957,American to motivate Portuguese Fintech enter it goal and develop innovative fintech and insurgech solutions in areas such as banking financial management,tech
2642,al understood in Germany and took even the interior minister Horst SeeHofer ask the player to be vaccinated coach Julian Nagelsmann went in defense his player and recalled that there is no obligation to,general
1980,In Fonseca they received scientific prize scientific Mario Quartin Graca for the Maos Chairman Executive Santander in Portugal Pedro Castro and Almeida and President of the Municipal Camera de Lisboa and President of the House,general
3284,in millions of euros al hilal trained by portuguese Leonardo Jardim drew home today with no goals with Al Feiha in a delay of the fourth journey of Saudi Soccer League failing approximately,sports
3601,VAT in health government stresses that today's report did not modify macroeconomic predictions disclosed December day that put Portugal with higher economic growth of organization in 5 8,general
3406,English tennis player Nuno Borges learned if today for the final socks 'Challenger' of the Maia after walking Belgian Kimmer Coppejans in two 'sets' while compatriot spending Elias did not arrive in Court Dev,sports
3592,of this article FARFETCH announced purchase of LuxCluclusif specialized platform in the luxury fashion resale in second hand in FARFETCH statement explains that business will allow leveraging the,tech
1794,The international physics now to be more young CEO between larger US quotes six years after having entered Twitter was promoted technology director of the founding company Twitte,general
524,estro that had been joined among the alternates annotated an honor of honor genova at 78 after two detachments followed against fiorentina and lazio both by 3 1 sampdoria goes up to the 14 post counting point,sports
1440,EAO European Chelsea second with 13 Zenit third with five - that continues walk in the Europa League and Malmo room and last positioned with one and today I think everyone is connected Champions VA,sports
3596,To the significant since its launching adocao iOS 14A Apple presents an official number of iOS adocao but still did not make for iOS 15 fortnite call duty and pubg are available on platforms,tech
1321,ROPOLITANO DE LISBON OF THE POLICE OF SECURITY PERSONAL PSP explains in a statement that detainees will be in the morning present in the morning present competent campus of Justica Second Authority,sports
2844,leave if thongs and a podcast video video dedicated to those who really like sport and discuss soccer and a program that is relaxed where the hottest games of the sema,sports
1979,If provisionally top of competition with points four more than Liverpool 34 seconds and five more than chelsea 33 and 'reds' and 'blues' face today Aston Villa and Leeds respectively,sports
1929,"So this year 75 ""according to the same reporting report makes"" a deep analysis on panorama of the technological industry in Europe countries ""highlighting some key trends and presenting a Diagna",tech
2510,It ends up for six years that Benfica was not going to the 16-year champions when we took a lottery everybody thought that Benfica could not be able to find out in this group Jose Manuel Francisco who has encaced Unica Li,sports
2864,Under the revolution Bank UAB regime finds it enabled to accept deposits or other funds refundable in national territory according to Banco de Portugal the deposits captured in Portugal PE,tech
3605,VARZIM for non-compliance with the rules defined for current context of pandemic having operations elapsed with a collection of the Republican National Guard and the Public Security Police Operation,general
1789,"s Between Fans Before Benfica and Dinamo de Kiev Estadio da Luz This Wednesday have resulted in the detention of people ""by the 19h30 stage exterior verified whether storage of disorder between adept",sports
407,Players that Carlos Queiroz Lanced Time Enter the and 106 Rendem Marwan Hamdy and Omar Kamal respectively with this triumph Egypt assured a vacancy in the final socks of the race in which he will face T,sports
3613,Nio Guterres will participate in the opening ceremony of the Beijing Winter Olympics in February 2022 after several countries have announced a diplomatic boycott indicated Thursday S,sports
1580,M years will take office by replacing Fernando Batista having first experience as a technician after ending career in November 2020 to the servant Estudiantas Mascherano fulfilled games for 'albic,sports
1588,NCILIARMOS With all Angolans realized Joao Lourenco saying that evoke history is not going to walk back and repeating the past errors due from time to time not with other goals but only C,general
3537,Regulation including formation frequency which is destined for them by the Institute Employment and Professional Formation and one of the measures announced in November when it was the closure of,general
1465,"Chuln national and international panorama ""unfortunately in this chapter Portugal continues to show very significant delays of innovation access in comparison with other countries of the European Union"" Salie",general
2414,"Proper revenue has to obviously receive less from funds state budget and those who have less capacity to have own revenue has to receive more ""defended Ribau Esteves highlighted that in Port",general
1248,EMA Scientific Nature Portugal and one of the Member States European Observatory Sul an intergovernmental astronomical organization,tech
2823,2 21 CapitalanoVabase purchase plus 5 045 actions own and pass hold 2 21 capital NovaBase bought last week 5 045 ACOES DELIVITY Your repurchase program passing hold 2 21 your capital,general
1260,"M 2021 today released Mark Zuckerberg's goal company that holds both ""Meta 'Year Review'"" Today disclosed refers to the most commented themes this year in Portugal in both networks as well as",sports
2760,"They are from the damage, ""said Biden quoted by the Agency of News France Presse AFP Governor Kentucky said that one of the tornados traveled more than kilometers status one of the largest recorded distances ne",general
667,already visit stores to see products before opting for purchase on sites and assumed by 56 1 of respondents who usually shop online program remote working cable green digital named,tech
282,Neymar's Eracao Follow In Forecast and Return Happened Monday January Neymar injured in Vitoria by 3 1 About Saint Etienne Telling for 15th Ligue 1 Journey,sports
3600,"in humans next year ""opening parentheses to say that it is difficult to have conversations with monkeys currently users data are new gold as such a database with location million",tech
273,Quicks Development of Sacrament Kings with DJ Stewart Pointing points Being Mac McClung from South Bay Lakers Best Meeting Meeting with 29 Kings are the classified rooms of the Oest Division,sports
2086,is this portugal but they are also scaling faster and number of decocords companies that are worth more than thousand million dollars duplicoum and hit companies for years could put all unicorni,tech
3617,"Observe in Portugal, highlighting that and urgent to offer adequate options to workers Porto University and Bosch officialize this Tuesday 7 in the Rectory of University Porto A CIE Partnership",tech
3091,of the winning formacion championship follows 10 place in the call 1 with points while lens continues in 'free fall' after a great start at this time and this provisionally fifth with points alone,sports
3562,in June of in Toquio Masayuki Uemura formed in Electronic Engineering Chiba Technology Institute Institute of Chiba Technology worked at Nintendo between and 2004 at the console manufacturer,tech
2083,"and only ""by the true argument but already spent a central block and a way to grow the extremes system"" ""less than someone is thinking that now that comes a few money bits",general
1528,"Unfair commercials of the large platforms that act as ""access controllers"" to the Gatekeepers market for Wednesday is still scheduled a debate with advice and commission on the subjects in the",general
2375,of meeting approach that has come to be adopted by governments and companies that built a commercial scale installation capable of producing fuel from air out of the hydrogen,tech
