,news,label
1244,Acquire all these products with a discount of 62 through SGO62CONHECHECHECE More oppcoes Office on this link In addition your main star and three times warmer than the game would be a co,tech
3027,Inclusion of an OLED Escra Ltpo from inches with an update rate of Hz Record If in the Edition of Mobile Word Congress Shanghai Oppo revealed to the world Oppo x A smartphone concept with EXT screem,tech
3236,Microsoft has been able to create as imposible eventually if it is known a massive loss of data those stored in DNA can last long periods of time by knowing that storage,tech
3388,It is important to ensure humanitarian and labor conditions dignified as much as employment itself over the last five years Servic Jesuit to refugees already found employment for migrants,general
2547,"REM of the same homogeneous programming ""Second document This mortality rate reveals a high impact of the pandemic in the mortality risk analysis of the pandemic also emphasizes that this value and Superior",general
2896,Honest Biography BioGraphy Antonio Guterres Honest Biography of Antonio Guterres in Portuguese in May United Kingdom getting available during summer in the main US bookstores whose published,general
3240,"Already older with some difficulty of mobility ""questioned about what can be reason for such situacion Carlos de Sousa Amaro frisou"" I do not make a minimum idea also that they do not understand what reason",general
1687,"and psychology ""Alem strategic plan Anndvis also announced first convening of athletes for male and female goalball selections and soccer for blind and new names for technical teams",sports
1452,"Inimaginavel Gedia ""the tornados who have made dozens of dead and are reaching several states of the United States of America since Friday we learned we learned we were excavating in this mission",general
1140,"of the habitation that continued with Cuvid and with scarcity of chips will keep if ""says Keogh return sector to normal in the USA will be gradual and tend to start downloading price sacrificing margins n",tech
2319,Om a goal of Michel Ange Balikwisha the Greeks who had Ron Lopes eleven have three points Lider Eintracht Frankfurt 12 points that tied 1 1 with Fenerbahce de Vitor Pereira and follows,sports
2665,Tre and 2011 in a career in Europe has noticed Servic FC Barcelona being twice European Oliveirense champion today lamented the disturbances on the stands that suspended on Wednesday J,sports
974,IAR A DIGITAL ENDER END AND OBJECTIVE OF THE NEW partnership that joins Innovagency and BuzzBeat Two announce today that they are going to integrate competencies and their teams in a complementary way and strengthen,tech
573,V and Anatoly Karpov also has six triumphs but in two straw straw circuits returned to Sporting in 2020 21 after two lands of loan to Sporting de Braga and Bellenens,sports
1001,and jewelry with 37 of complaints that concerns strikes there was an increase of false stores online mainly of the brand of stradivarius robe is and even more claimed mark during black f period,tech
3726,Personal thugs in protagonists of small hilarious musical videos this time their latest experience and creature of art frames in a few seconds and double-click with them,tech
1168,"... we do not see how to buy and part of a conversation with someone who is something less in the physical stores nowadays ""quotes BBC in a total of emojis the one who"" cries laugh ""comes back to be more usad",tech
946,"ISMO argues that and then ""relevant improving disclosure of adequate channels This report"" CNCS document states that besides the national strategy of CyberePaco security and their acting plan iden",tech
1164,up to 2032 However I agree now extended such a measure for more years new updated regulation enters into force of July 2022 at the same time with this new regulation we also improve quality,tech
987,"o and promise you guide by the fundamental concepts of photographic art old fashion polka retro camera - original price - 0 99 dollaresterminamos our selection of ""tassels"" this week with an application p",tech
3533,from September when it was known that I had left parents according to the national director of the police court judiciary pj luis neves joao rendeiro reacted with surprise detention ex banker joao rendeiro fu,general
3653,I send fifth consecutive game without winning federacao Angolan soccer punished today brave maquis with a game closed door in the next journey Angolan football championship whose adversary of this doming,sports
3768,To define future reminders teenagers will particularly receive notifications to activate these reminders and tips from experts to help them reflect on need for this pause and with,tech
3433,several sectors will as color year per per peri color year of 2022 second pantonevery peri arises named by pantone as color of 2022 color selection process pantone year according to company requires a consi,tech
278,"this asymptomatic but will isolate if and fulfill orientations of public health authorities ""le if in a statement of haas still without any point this year Mazepin has as best rapturation 14",sports
885,"Strucoes in it presented if a ""ejection of coronal mass"" as well and called explosion act reach land can fire satellites in orbita and cut energy networks from cities by norm acconting",tech
1316,the millions of vinyl discs an increase of 86 face 2020 and even more setting to have an edition of the height in which was launched Nextqual quiz was more sold vinyl disc in 2020 confirmation of an,tech
811,Son measured to save your family between challenging puzzles and new environments all to find out how and that saga ends up click on the pictures for more details about Faraway Galactic Semel Exhaust,tech
3070,Al and the Assembly of Representatives for Mandate 2022 2025 of Mutualist Association Montepio General Mutualist Montepio has a thousand associates and and top group Montepio Being its main company Banco Mon,general
1546,Ina Official of the president of the Republic on the Internet in November Assembly of the Republic approved in final voting Global a text agreed between the different parties relative criminalization Enrique,general
52,"We will follow compliance with these measures quarterly ""explained ITU that obliges a Russian federation to reach an agreement with Russian agency angioping Rusada to perform all athletes ESPE",sports
2709,admitting that one of the most timid squad revealed even if he wanted to be a nets and if he played with the right and the district would have place I am one of the older squad there is something CUR,sports
1744,vo chief of the novi stephane kasriel and by cathcart whatsapp or Icone clip android or in iOS just select option payment payment menu for these transferences novi avanca that does not exist,tech
2192,Publish before incident is already exactly leaning on this strange relationship Pinto da Costa until left clues when asked about Portuguese selection subject 17 was integrated Grup,sports
1691,U Schalke and Erzgebirge Aue Born in Italy But with Germanic nationality Tedesco signed contract with Leipzig until June and Fara his debut Saturday at the Receck to Borussia Dortmund de Raphael Guer,sports
3270,EU from Monday Larger citizens of years can mark time to receive third dose of the UK vaccine and one of the countries most affected by Covid 19 with more than 146 000 deaths and fence,general
750,Extension words pass in iCloud as we show below president of the United States of America USA announced an ambitious project to accelerate transition for electronic cars the terms of the initiativ,tech
3724,OR of Mexico Passing this year a record number of arrivals not from Honduras and El Salvador but also Haiti Start of October State Secretary of American State Antony Blinken said that,general
3720,The local railway quarter where it was born despite these numbers there are resistance foci mainly between younger layers that are currently target group of the Olga Laurinda campaign another young,general
3340,Vivio being with friends making friends I like interaction with people to talk to cosplayers for their turn Paulo Trindade who plays a character from Star Wars states that and Pri,general
760,second half of 2022 along the matches will discover new equipment for herois as well as items to improve their noobly skills can be downloaded for free and this one,tech
3260,All authorizations and all necessary legal and statutory consents for the purpose of the same fusion will culminate with Extincao Banco ABC Moccambique December 2021 LE if in CO,general
1745,FJN with this partnership are already available vacancies of new IMS courses for scholarships reimbursable ISA FJN applications for students of these courses are open until the December and FJN has a,general
544,Antevision at the game with trainer Sergio Conceicao FC Porto Lidera League with points the same second place Sporting while Sporting de Braga and room with 25 sporting current DeTentor Trofeus will receive,sports
3496,"in Dara ""Voice to the people"" about regionalization without referring his speech word referendum were municipalities that also often complemented that State did to support these Sectors of AT",general
3064,And Slams' in singular and other in pairs died today to the years announced Mutua Madrid Open that he was honorary president born in Madrid in May 1938 helped popularize tennis in Spain and CRI,sports
928,Dyson Company has already stated that it will appeal to the decision core of discussion this obligation to compartment with empty compartment something that Dyson defends does not correspond to a real coarse,tech
780,decided to choose best extensions of and presented now your list best extensions for chromedo that google in the year of was very rich that plays proposals for chrome there are more proposals pa,tech
1997,Free charged and is available for both Android from the Play Store and for iOS in the App Store according to a search commissioned by Natixis Investment Managers Cryptomoedas can,tech
3098,and work and in itself an experience work experience begins when we schedule alarm clock for a certain time we choose adequate clothing to the context or we plan our agenda and experience,general
1845,Years followed by beating in the final Flemish while Athletico Paranaense conquered South American taca after overcoming Bragantino in decision in the last Edition of the South American Supertaca the Argentinos Def,sports
2620,Portugal should not let the millions come out for what advocates offshore criminalization or accept that those who committed a crime of millions Buy right to live in a country Portuguese authorities Ja Ti,general
745,Action of disinformation and false news on social networks said President of Turkey in a video for a communication conference organized by the Government in Istanbul last year Turkey approved,tech
1655,I might of your smartphones and using an extension of memory with tests to take place in the new version of Miui based Android 12 was noted that this option is missing more logical and that it does not seem,tech
266,"When he had played again until 2022 because he still suffers with infection according to coach Julian Nagelsmann German International suffers from ""pulmonary infiltrates"" LESAO that can ""cause respiratory difficulties""",sports
503,Soma eight consecutive victories and had tried to arrive ninth in front of the axadrezado front of the Boavista Sporting Soma Vitorias draws and only this daire already mentioned players available for a clash,sports
1839,"Short Duration The Schengen Visas of Tourism will continue to be required ""But"" National study or work visas will be automatically granted ""Agreement to enter into force",general
3339,Thus taking the parents and more and more Portuguese Space inaugurated in Coimbra and first totally dedicated planning of house divisions and the personalized service in the center area,general
2476,"Er a global say of more than millions of euros ""with simplex simplex now will now have a"" huge 'boost with recovery plan and prr resiliency with almost millions of euros for transition area digit",tech
626,S during the first half of 2022 is not known much about the future graphics processors of Intel GPU by now denominated of ARC and demonstration that manufacturer presented during Gala Game AW,tech
2936,and sentenced a suspended prison sentence for six months in the sequence of this Nice incident was punished with two points in the classificative table one of which can be applied in case of Rein,sports
966,that there is little competition in this market in Portugal Something with which operators vehemently disagree the OECD report should launch more firewood at the Telecommunications Bonfire in Portu,tech
3232,furniture and soon it will be time apex legends have a mobile version and already made announcement and have in the google play store a teaser with possibility of registration for test of the closed beta version of battle roy,tech
184,Idu Tecio Oliveira Toni Martinez and Fabio Vieiraonze SC Braga Matheus Tormena Paulo Oliveira and Bruno Rodrigues Fabiano Andre Horta Al Musrati and Moura Piazon Ricardo Horta and Abel Ruizsupples,sports
2981,"base stavel these centers ""added Siza Vieira Elon Musk came surprised with a publication about his future in the businesses writing Twitter that this"" thinking ""let your jobs for",general
1027,If suppliers of goods or service providers can offer freely well or serve a lower price equal to or greater than offered by the intermediary allowing the market to function,tech
1107,SIMETRIC AND SIMETRIC INCRIPTION Reverable transforming of data by form makes them intelligible reversible transforming data by form makes them intelligible detractals Operation involvement,tech
21,Women's Overcoming Brazilians Maya Gabeira and Michelle des Bouillons Athlete and Family meet Although enormous discomfort caused by lived situacion refers to club in communicated pub,sports
553,Gui reaches this goal I have to thank the Mister and structure for the confidence deposited in me affirmed the medium since I arrived I was always an exemplary professional and I gave everything for this club acres,sports
2054,"R A clear and credible strategy for medium-term orcraft consolidation ""which touches the direct supports OECD companies advises the reinforcement of them"" in a timely manner directed and temporary",general
1361,study whose main conclusions were released in a communicated by the brain feelab is more instinctive in the identification of pain and brain rabies facial seeks to map all the traces that allow,general
1627,for technological marketing and sales soluctions announced that it will open a new center in the city of Braga reinforcing brand of brand in Portugal new desk that will be located downtown,tech
2637,three thousand thousands of spectators being the most visible ever according to a study today released by the International Olympic Committee Coi Official Coverage of the Japao Games Through the Digital Platforms,sports
2560,the rui river there are not red lines if they think that work I made and deserving that I pecro and that they think so if there are people who think that I have a father who and the leader PS and that has relevated functions,general
3753,"Furniture Code and Regulation No 5 2008 CMVM ""European Commission presented this Friday proposals with a view to achieving the objective of all adult workers to receive formation an",general
3494,thin is not a good presence of some islamic schools with radical orientation niassa also favors installation of armed groups in the province continued unfortunately if a tenden,general
2630,In combined NASA can form images that can give more information about how the celestial objects that emit X-rays operate according to forecast forecast stage rocket will land drone,tech
3181,"Book in honor of these ancient athletes such as cultural agents and former combatants these old footballers were the ""great ambassadors"" of Cape Verde soon after Independence of Portuga",sports
2208,and 46 in October Economists ears by Reuters predicted a rise of 6 8 IPC Novobanco will make available from their South Northern parents parents to help collect food clothing toy,general
755,Possibility has now been reinforced after Chinese Lenovo listed Radeon RX XT graphic card with a GB memory capacity GDDR6 This is expected that graphics AMD RADEON RX XT is formal,tech
2093,for a total of thousand euros for direct adjustment in Oeiras we work every day for the happiness of all municipalities and that is why we present the highest levels of development and cohesive n,general
2800,Ceber Miui 13 There is another list that not everyone wants to know we speak of Xiaomi's smartphones that will not receive this version given its immense adhesion certainly that many rom will emerge and bring an,tech
1414,"PORTANTE FOR COMPANY FOR SECTOR AND FOR ACORS ""Projecting"" for modernizing competitiveness Innovation and sustainability ""in a statement refers if even lactacores has the",general
1113,s enemies distance projecting if and pushing out the fighting with vehicles continue to be vital mainly in this larger and open world are through the warthogs as ghosts and wraths that f,tech
89,Birds in Camp Nou in minutes game of the 12th day of the Spanish Soccer League after feeling a breast discomfort following protocol for this type of international cases 'Albiceleste' was transported from,sports
3509,Technical Commission on Vaccinacao against Covid 19 on vaccinating against Covid 19 in children with years here want users to control Windows in the most natural way possible or with voice,tech
2735,Socioeconomic impacts of workers of the Pego thermoelectric plant that closed recently announced today government to apply for workers must comply with established conditions,general
2457,In New Orleans where he was born Christopher Rice quoted by the Agencies of Associated Press and EFE interview with a vampire a book that was adapted for a homonymous film with raw tone,general
16,I am competing Saturday at the victory by 2 0 front of the Boavista while Paulinho continues in isolation Ricardo Esgaio was used in the departure against the axadrezados having aligned in the second part,sports
329,"RONESA ""wrote ancient advanced in the social network Twitter ex-ponto de fc barcelona inter of milao and chelsea stated yet"" every vote represents energy and ambiance of family soccer camaroles pa",sports
3001,"Mind with Francisco Conceicao figure Clinical Bulletin being advanced already evolved to ""Conditioning Integrated Training"" in turn Guardia Claudio Ramos was ""given as apt"" and was technical orders",sports
403,By losing on the visit to stadium penafiel 2 1 of the II League but will discuss in Mafra access to the 'rooms' of the Tack of Portugal after already having oriental dragon of the alloy 3 2 after extension and prim,sports
3385,HIRTS promoted Portuguese fashion brand of Sonae Fashion during October - International Mes of Prevencao Breast Cancer Angerou more than a thousand euros Favor IPO - Instituto Portugues de Oncology Starts,general
1011,ESA stresses that this is an initial phase and that the contents still do not correspond to the flow that company wants to have site at this time site highlights a session on pop obests this year and,tech
2525,"NCOS in voters ""We hope this is a time of betting of betting associativism eclectics of the transversality formation football and the active participation for an increasingly strong star and",sports
43,Best Conditions for the League Respecting October November repeating as soon as I had won in August guarding years nets obtained 40 48 percent of the top coaches',sports
2786,Travel undertaken by migrants and deeply dangerous and will not succeed during a visit Mexico City Paper Flower Non-Essential Fourth Festivals There are several events that,general
679,IAR in what the digital influencers of this area has to say in general 59 of the adults who follow influencers refers that it relies on the recommendations of brands and the advice given by figur,tech
75,in the sequence of a technical problem with software from an external service provider indicating those responsible eligible teams to play with others occurred an error material raffle of the,sports
1111,ara divulgation of science and technology in portugal for those who have lived with him will be missing the true friendship and the good disposition the fas of the halo saga awaited since return of master chief p,tech
3464,He believes that assessment of decentralization of competence will be positive underlined that he can in Dara Voice to the people about regionalization without referring his speech word referendum SVF AMV RCS JAPLUSA,general
1470,"January from January start from January there are modalities ""via green motorway"" and ""via green mobility"" as we inform here for Portuguese association for consumer defense deco increase of PR",tech
2442,of 2019 but reducao was only 3 8 minus 3 925 passengers in November of this year disembarked in acores 3 136 foreign flight passengers plus 338 than in 716 and less 60 1 which in 7 868,general
1661,New Zealand grammatical inconsistances and link that is not valid also proven manipulation of the country image also implemented compulsory vaccination for a large part of its workers and if I,general
3557,This Saturday years of years is not yet recovered from the LESAO in the right thigh suffered at the reception to the Pacos de Ferreira for Taca de Portugal International Servio and Unico injured Benfica,sports
2336,managed to affirm as in the first passage by the 'Leoes da Serra' Diego Medeiros lined up in matches and did not mark any goal this extreme time played Sporting from the covilla in 2018 19 per loan,sports
1143,"Njunct of European companies under 36 in for 42 in 2021 higher value registered in 19 ""in 2021 98 of European companies with or more workers have access to this type of service""",tech
3567,the time in the life that and the carecas that they like more and from you below alias that complains who is losing hair especially if age does not rhyme with a glossy scalp and shows and every v,general
3387,R Mudanca since the court proceeds to continue to note if that his EPIC GAMES side also resorted to the Appeal Court to challenge some aspects of the Decision of Judge Yvonne Gonzalez R,tech
13,Europe coaches in the latest tests to detect new coronavirus responsible for the pandemic of Covid 19 made by the side club of the lions that this asymptomatic tested positive and was col,sports
2679,respondents would not feel comfortable in returning to work if such measures were not in effect as a document points out that the countries where workers favor obligation,general
191,Benguela Ring by 2 1 In the Angolan Province of Benguela Benguela and Recreational Caala Recreation Dream 1 1 In the Angolan Province of Benguela Zico to minutes marked for Caala recreational,sports
3164,and development as well as six prototyped generations rumors about Oppo's first foldable smartphone pointed to some of the possible equipment as I,tech
3402,MPRometer Rhythm of Economic Right EU funds available will reach ineditable levels - are about a thousand euro million between and 2029 in particular environmental recovery and resilience and D,general
2033,FO Behind Tottenham from England for 1 0 This was second passage from Jorge Simao for the North Club after having oriented Club of the Mobile Capital in 2015 16 Early in which he got Sevento Place Cam,sports
675,"Thought as these are indestructible in case of accident this ""black box of the earth"" will be placed on the occident coast of remote tasmania in practice in question this one box in ACO with met",tech
1812,parents are now taking place until December after initially deadline have been established for December the candidates will take interviews with more than an organization and who p,tech
2132,Weekly Tema Exclusive publication for subscribers who anticipate and complements the contents of the magazine Mensalna cover of this Weekly Edition We present you New Chromebook of Lenovo - a tablet that t,tech
1663,Contro made even know how to know how to know how to know,sports
3017,Ale allows players to participate in struggles in several arenas with even participants and arrives late mobile platforms despite it and has guaranteed two years that would be available on Android soon,tech
2084,Pain take some time in another topic considering sensitive WhatsApp functionality developed by the Wabetainfo Beta Version that allows users to define automatic messaging exclusion,tech
1518,"The cohesive policy but there is a risk of absorption to be slow although ""Portugal has been successful in the use of European funds and having experience with financial assistance programs"" this porq",general
933,Verified Economic City Prede also a strong economy recovery in the following years with GDP increase 14 between and 2023 4 8 in 2021 5 8 in and 2 8 in 2023 ECO digital transition,tech
741,investigate cases of sale of sanitary passes Couvid 19 false announced recently inner minister at a time when patient hospitalizations are increasing dramatically in every country director,tech
531,absolutely incredible this happening we will live moment in the best way possible until end guaranteed always active in social networks Jose Mourinho left a thank-you message to zorya,sports
2129,prince of our waters but also at the regional level added nature of this type of projects historically says in that only one in ten projects and economically viable so it wants to say,general
3321,"For Camara Leiriense in short and true that Leiria spent about a thousand euros in decorations and amusements Christmas spectacles of 2021 for today this planned voting with ""Braco Ar"" Das Mocoe",general
