,news,label
1410,Ate euros monthly with all these alterations and fundamental do accounts to realize that it will change your liquid salary in 2022 so that simulator of correct value needs only to ensure that,general
1385,Meeting that is longer than any World Championships nearly eight hours of fighting and registered movements Various Russian mistakes of years have left Norwegian path of history books,sports
2701,L of 14 Journey of the League Analysis to the game We made a good first part We were patientos,sports
2806,"Lhoes de homes for energy network in Peninsular Spain and Canarias Efacec islands underlines that ""award of these works happens after a demanding process of negotiation in competition with the PR",general
102,rto quito five and deportivo cuenca olmedo delfin everest and now independient del valle all with one are the other champions football equador notifications webgoal games SL benfica games fc port port,sports
2690,s this dawn has suffered a viacao accident center advance newspaper record that Sporting has been attentive to what happened and that even said with Valladolid and with Gonzalo Plata,sports
2043,"Friday and Sunday that will decide assignment of pilots between Britanico Lewis Hamilton and Dutch Max Verstappen as well as builders between Mercedes and Red Bull ""We are delighted by",sports
2977,Ursula of euros millions but dortmund does not even confirm the values and does not explain if player has ancient cloistered Brazilian footballer in treatment a colon tumor detected and,sports
3667,ZENING SSD NVME claims show that it has a much weaker performance loss performance in the NVME and significant Windows 11 SSDs and there are cases where the values show that speeds d,tech
19,Award 'Performance' male from the Brazilian proof also snatched galard to team together with Hawaiian Kai Lenny who had expired individually in the last competition edition in 2019 Prem,sports
1131,to phone cooler chroma this for already available at razer online store in USA by 59 99 dollars latest Christmas shopping are a classic of the festive time and that this year are made in,tech
2486,if after completing in the 'lions' formation initiated high of lisbon and sacavenense and my sixth contract since I arrived at Sporting with years already la vao almost years and truth and that time passes run renovac,sports
3138,Viseu with an argument that the contestaries could have appealed to the internal organs party yet Ventura took the opportunity to say that there is always a fringe of militants and leaders who prefer to,general
2840,Coortups Portuguese that will participate in a four-month program to help develop expansion plans in New York United States of America - Portugal Tech NYC program and composed of,tech
1947,"the truth and that were good sensations and I believe that team is prepared to compete and compete well ""assumed how much strategy for Saturday technician assumed that"" will not change because of this stop",sports
2015,Action of the Portuguese Industry Antonio Saraiva President of the Confederation Comercio and Services of Portugal Joao Vieira Lopes President of the Confederate Tourism Portugues Francisco Calheiros and President,general
1792,"work professionals in particular to facilitate organization recruitment further underlines ""to ensure inclusive recovery will be necessary to strengthen public policies",general
2809,I act in different ways from formacoes help manage the backstage of financial operations A recent global study of the Visa shows that 40 of the holders of crypomoedas admit that Irao proves,tech
272,Or to be exceeded by Lukan In addition to the points seven in nine in Portuguese field lunches got six rebounds a disarming loan and a ball stealing was second best marker,sports
93,inal that surpassed in 2005 06 Liverpool 2011 12 Zenit and 2015 16 Zenit and in which 'fell' only in 2016 17 Borussia Dortmund Real Madrid and highlighted leader of the Spanish League with eight VA points,sports
2990,Government ceded and downloaded VAT from construction to 6 but only for accessible habitation for Jose Cardoso Botelho CEO of Vanguard Descent VAT Properties from 23 to 6 in the construction of accessible lace and U,general
2271,Te among taxpayers and state these three promulgations by Marcelo Rebelo de Sousa are not a note published on the official presidential page of the republic on the Internet the decrees now p,general
263,Visitors The two candidates for the places Cimers continue to produce themselves as expected below being that Lille tells only two victories in the last nine Ligue and Lyon meetings,sports
1010,which seems little logic to have teams and not be authenticated this can be a complicated netflix situation inaugurated a new site where you will publish information and news about your series and free movies,tech
2464,Idemica of SARS COV 2 of high intensity with strongly increasing tendency National pressure in health services and mortality impact are high and with increasing tendency revealing,general
1506,"which hold both ""Meta 'Year Review'"" refers to the most commented themes this year in Portugal in the two networks as well as which Cancoes and 'Hashtags' most used in platforms such as Inst",general
358,s minutes played very favor victory that took the opportunity that was missing to win if we had been more effective in the first part maybe we could have won game expelled manu Hernando explains a lot,sports
809,Israeli Cryptacao that camoufla communications for Portugal Faraway Galactic Escape and sixth chapter of the series of faraway games that states as a kind of tribute to the classic Myst and Q,tech
561,U move on in the Millionary League and I need to retreat until February to find last victory against Real Madrid in games Tell Spanish League Athletic Bilbao gets Saturday Seville,sports
3109,"Last years invents already helped more of organizations protect their inversions and also responsible for the barometers ""Made Portugal Patents"" and ""Made Portugal Marks Lancados annually by the consultant",general
112,Shallow header post of grujic 45 2 The young people were entering side SC Braga who was growing game and even could have left with another result Dragon moment of Luis Diaz hat extreme was suffic,sports
895,of December DAO to know that 71 3 of the inhabitants have at least one dose already 66 9 has complete vaccination existing here a vaccination fee ranging from 26 2 and 82 in Portugal where,tech
2882,S of his students published study in relation to the levels of proficiency by Banner Etaria Lower levels register if group of teachers aged over the time of service est,tech
3379,M Analytics and Data Science Business and latest Example of this constant Concerning POS graduation can give rights in the final Metyisno of POS Graduation Students will have opportunities,tech
3581,of the United States selection oriented by Francisco Neto that in the last disclosure ranking in August was in 30 rose a place on the list and managed to equal his best ranking ever,sports
430,"erdiated a penalty by griffin 62 questioned about president support and group this united jesus stressed that Rui Costa ""every day is Seixal"" and that both have ""a bond of friendship but also pro",sports
2112,As one of another player originated an end meeting that Benfica vencia for 7 0 LPFP held realization play with absence of a formal postponement also meeting between Tondela and Morirense Ecoument,sports
2224,"Espressavel Jean Moreau Co-founder and Phenix CEO for Jean Moreau Geografical expansion presents if as one of the Portuguese Market Challenges ""Going from Dai we can follow one of two ways go to the PA",tech
2611,"l tournament winner 'Grand Slam' ""There are people who convert in legend and who make great a country manolo santana was and will always be one of them"" can read if in the account on the social network twitter of the family",general
2893,Munich who today thrashed at home Hacken by 5 1 While incarnated occupy third place with four more than quarters and last ones with a fall for Europa FC Porto continued in the evidence of the,sports
815,and these are available through a simple digital platform objective of this platform and make all the digitized jench community where it is possible to know many details platform d,tech
956,A - Portugal Tech NYC program and composed of workshops and mentoring sessions to develop appropriate products to the North American market and will address Northern technological ecosystem specificities,tech
175,La 1 on Second Protest Mercedes understood that there have been contradictory orders from the race direction on what to do with the pilots folded last Safety Car that decided to run and title of pilot pa,sports
1933,Movement by the guard explained Lusa who issued a demonstrable opinion because a project prospective in two Tervos county and paregisias in a press note sent by the deputy sent,general
3465,"Simpllex also allowed to deliver a thousand statements for access to the family allowance Alexandra Leitaao recalled that government estimates that ""for an investment of about 25 million euros can HAV",tech
902,Save here in its main conclusion report states that competence of teachers are considered low in the same way a greater digital capacity of teachers also means with,tech
565,Var Best 'Tie Break' At one hour and minutes on the 'Borges',sports
2101,theme freedom and sustainable director of the pj gave a press conference for the bad luck of Joao Locairo was there to be elections in January published Rui Rio in his account on the social network Twitte,general
911,S Home An international operation taken by authorities declared death malware emotet but ten months later malicious software seems to have reborn grates to the trickbot avanca a new invention,tech
143,with a result but with everything that is apart with the kids of the formation this side and quite positive four defeats with the big three we went to play the ones we lose the adversaries were,sports
1063,20 says it has not updated for waiting for even more improvements 539 votes while 7 says likes more previous system that has 176 votes ja 5 confesses that it did not proceed for lack of time 133,tech
2853,and ownership and retired holders of the public administration and their relatives Paulo Campos was accused of ten crimes of economic participation in business by the alleged benefit of several concession,general
864,facilitates all installation and up to arrival of uplus updates already had started this process but ended now for having to reverse all the fruit of problems that have arisen with this oxygenos version 12,tech
1202,ACAO Portuguesa for Consumer Defense Deco increased prices of 50 and green exclusivity abuse provides a service online so that drivers can consult all information about being,tech
480,"s study are at this time in submissions in scientific magazines Ana Verdelho advanced that if it was perceiving that contact also ""and very important"" for these people as well as way",sports
3752,Equality and inclusao with the most of employees brand internally promotes a week of dialogue and inspiration sharing through various actions conversations and workshops this year motto,general
1815,"""Underlined a delegation from Fenprof delivered pamphlets to the mayor who participate XXXV Congress of ANMP Locking Rept for the postponement of compulsory transfer of forecast",general
2144,Lessers who have cryptomoedas and does not treat if popular KMSpico activator in an altered version with malware with the goal of infecting Windows equipment and stealing portfolios of the KMSpico digital currency and U,tech
1491,Uisitos even 1 079 votes in turn 20 says it has not updated for waiting for even more improvements 539 votes while 7 says like more previous system that has 176 votes ja 5 confesses that not,tech
2362,The Germans and secured first group with Lille points can be adversary Benfica or Sporting in the final 16 of the Turkish Burak Ylmaz proof opened as soon as possible in a bid of,sports
2644,Association in Portugal in November 2021 book if 8 249 enterprises in activity an increase of 14 when compared to November 2020 questioned about the market for all societies Paulo,general
1367,"Uros ""conductor vehicle of years was detained by the practical crime of fraudulent introduction man consumption was constituted and the facts communicated to the judicial court of Braga seizure",general
1362,"In a sect full of auto deputies ""stressed"" are their right but question Eurodepower attitude at the meeting in which lists were approved by many who were in the Rangel campaign",general
527,Rgo went up to the 14th place with points as Colonia follows in ninth with 19 but who leads Bundesliga and Bayern Munich with points followed by Borussia Dortmund with 30 Bayer Leverkusen with 27 and Friburgo with 24,sports
2452,NUE technical command of the incarnates while Marcelo Gallardo said this Wednesday that will continue in the Argentines River Plate for another season and made by the website GloboSporte that,sports
1736,"with the social partners who create individual accounts of learning and provide forms of formation for all adults at age ""LE if in the documents disclosed by the Commun Executive",general
595,All Walant Wide Awake Local Anesthetic Tourniquet procedure and can be able to give a more interested response to your patients as expected Apple after Laranco Versao RC would act AGO,tech
1188,of Glupteba Botnet linking two individuals in Russia and has grasped with a judicial process each in an attempt to create a precedent and help discourage this type of activity company explains q,tech
808,MA of Israeli communications that according to PJ costs exorbitance according to PJ to communicate with Portugal ex source proxima process revealed that ex owner BPP used a super system of EN,tech
1873,Ntistas at the University of Coimbra obtained 1 2 million euros of the NEW NEURON - A European Financing Network for Neuroscience Focused on Brain Donations and Disturbances System Ne,tech
3160,Omo name suggests and a tariff for the newest who has been launched in 2018 This tariff has become quickly in one of the families' favorites designed and adapted needs of the smaller and,tech
3268,"This is not considered being paranoid when it chooses to have communications with wired headphones ""but which difference between symmetric and asymmetric encryption encryption transforming revers",tech
3118,"""As it may be fair as it can be correct as it can be possible to agree with extradication Julian for parents who conspired to assassinate"" Cita Verge Julian Assange and accused of conspiring for",tech
2467,"Zbigniew Rau said ""hopes that new German government is ready to take on this responsibility also in the form of conversations about compensation"" in response this baerbock challenge guaranteed",general
181,this Sunday count for 14 journey of the Taremi League and alternate in the dragoes something that still had not happened in this alloy edition with Evanilson take alone front door attack and uribe reinforca,sports
2368,the luxury besides the restrictions on the trips and the quarantine imposition because of Covid 19 cancellation of the festivities in the city port also did not come to help tourism adds second,general
1899,"in different rooms and without never having contacted one with another ""air transmission through a corridor and more likely transmission mode"" concluded researchers from the University of Hong Kong which",general
3505,"P ""of this situation we have to register detainees being that the detainees were assisted by INEM and transported to hospital unit by elements of the police we have to report situations such as difficulties",sports
212,and 18 and last classified with eight points subscribe newsletter frog sport subscribe ja subscribe will come charters notifications activates notifications frog sport follow sapo sport on the nets soc,sports
1082,and centimeters of a proposal width of the German Hopper Mobility and innovative since their maximum and limited speed km h with Hopper drove on people moving in the centers of cities and,tech
2194,"saps for the speed with which they detained ""concluded a statement ex banker portuguese arrived africa south day of September second police would court Portuguese was difficult to locate it but final we can apprehend",general
2633,State of Guine Bissau will be immediately applied a rapid fine as this in the General Fisheries Law added General Secretary Ministry of Fisheries in question this second CEO Miguel Stilwell 'an,general
2473,Alentejan dutters said Lusa agency that received a registered letter signed by lawyer Antonio Pinto Alves in representation of registration rights to avoid similar situations,general
1123,Nonimato Ivacy VPN adjusts US dollars approx EUR54 So the discounts are in particular for this unique discount that Ivacy VPN presents us planning for years and that it is US dollars for a Q vpn,tech
2767,to criminal count with a possible resort of joao rendeiro extradication source of the South African police said Lusa that Joao Laeiro was arrested in the northern morning of the port port of Durban Southeast,general
534,Zorya 1 1 to end in Lideranca Group C with points against the Norwegian team Antoine Griezmann was one of the triumph figures Atletico Madrid Dragao who dictated Spanish champion,sports
1240,NVIDIA has spoken during global UBS Conference TMT on Monday 6 in this way waiting if that stock of chips improve when company to launch your graphics cards from the next generation these by your V,tech
2067,r of an option available for the newest that would allow notifying parents or responsible in addition platform wants to limit sensitive content for the newest suggesting a new topic if it uses,tech
1906,"""Online"" through the Social Network LinkedIn that and I need to take responsibility How many more scandals we have to watch ""questioned Follow's leader pointed to US Importance",sports
2119,"Voltages ""Solar energy production together customer and a huge opportunity that often and completely ignored and added"" this and vital to decarbonization energy sector and offers fern",general
1040,the most popular especially during Christmas and Gift Card Gift Card that stores offer their customers specialist in Ciberseguranca says hackers have several tactics to monetize D,tech
781,In addition to the previous ones and that elevates even more Chrome for users and their custom proposed needs for this browseresta only a list of the many proposals that Google found,tech
1884,UCI Stephen Curry this triples to become a NBA player with more releases of three points converted into the history of the NBA times basket after the line of points at interval already base took triples,sports
910,with sale of services and subscriptions digital bulletin and a weekly production echo by voice journalist Flavio Nunes Follow Spotify - ArticleSet.com Google Podcasts Apple Podcasts or wherever you can choose your podcast,tech
3087,"daughter kely birth had announced I will enjoy to make a new battery of exams so I will stay here a few days ""explained the skin of years in the social network Instagram"" was not surprising was already",sports
458,"Rutors dispute if this Sunday from 13 00 from Lisbon ""Arouca and a team that makes your home your 'fortress' I foresee an aggressive emotional game with two teams that will want to win every duel",sports
2530,EJA Follow that arrives again to your Apple device after more than a month of Beta Apple tests provided iOS 15 2 Release candidate for programmers and beta Public Testers iOS 15 2nd IOS 15,tech
1969,Lo Commander Porto and Maritima Police of Vila Real de Santo Antonio are involved Maritimes of the two countries according to Agency of Spanish news Efera Eforitos Lanked an Embed,general
1388,"to today as ""highly disturbing"" claiming that the North Americans planned to kidnap and murder their client the reporters without borders rsf also repudiated decision remembering that assange ""you",general
918,Much of them free of charge to be tasseling advertising and that some functionalities are only exclusive to paid versions for access to some of these verse,tech
1774,"Icanos planned to kidnap and assassinate his client Ja Russia rated Decision of the British Justice as ""shameful"" before a ""political case"" reports without borders rsf also repudiated",general
3501,"Eiro ""We clearly defend a new law of local finances, it is completely unadappled and we will work solidarity among the municipalities because those who have more capacity to generate",general
1679,unjustified ECement amending legislation on declaratory bonds of politicians and high positions publishing Members have also maintained in the law that we add equity,general
1966,"choices """" less than someone is thinking that now that comes a few money baus for a few years that is good for the central block and block of interests if they get together ""we can not",general
2839,"Conquer Points Footballer Bayern from Munich Joshua Kimmich will stop until January ""for precaution"" after being infected with new coronavirus but disease should not cause long damage Prozo guaranteed HO",sports
4,Umtros with Domingos Soares de Oliveira Ja Nuno Magalhaes and proposed to lead AG table and Joao Augusto Fiscal Council meeting this scheduled for the stadium of Light in Lisboa January 2022 PE,sports
469,"BLICACAO There is still no return date so Jorge Jesus can count on Radonjic at a time when Benfica coach was betting on him ""unfortunately and although all the efforts did not",sports
3765,EU can go to the days and ensures brushes per minute comparing with a traditional teeth brush manual this and an absolutely stunning value Christmas pack costs 81 95 Eure includes du,tech
2387,site where you show coverage of the network network of the various operators and service typology offered but this information was not available for fixed network President of ANACOM admits that this map of,tech
2218,"and of senior public and assumed positions that initiate renew or end functions ""from entry into force of this law, two crime processes were established by the identification of a minor",general
91,ATHY AT THE YEARS EX ATLETICO DE MADRID COMPLETE JA FIVE FREE GOVERS A GOLO by Catalaias After Seasons Manchester City Spaniards Real Madrid would be the adversaries Benfica for the Oithos D,sports
2521,M Objective to improve people's lives and their hearing Ring Generation promises to combine an elegant design technology helping users in the monitoring of their intelligent ring health,tech
3451,"Lives were lost or extension of the damages said Biden quoted by the Agency of AFP news ""This number will exceed 100"" said Governor Kentucky in declarations Television CNN Respond",general
142,we see an excellent opportunity for the moura with a ball at the pole made a very good game in front of an adversary that if it is not better and the best our championship globally we are not satisfied,sports
408,unisia on Wednesday while qatar also with place already guaranteed at this stage awaits the winner of today's match between Morocco and Algerimo Maritimo received and won today Santa Clara for 4 1 in J,sports
2829,By sharing your ideas do not always orthodox or logic you want to know your opinion about abandon your jobs and be influencing ideas that you share on this social network show that this Constant,tech
924,"Gle Play Although they are not yet met for already the details of this strategy Google reveals that it is a different product and not the result of a partnership with Microsoft ""this product build",tech
1519,the olive tree man and journalist who brought joy all oliveira had years and had forever as one of the people who contributed most to the disclosure of science and technology in portugal for q,tech
298,West of the European Super Cup of Raguebi with six victories in other many meetings franchise team of the responsibility of the Portuguese Federation of Raguebi FPR had already secured the week Passad,sports
1051,Ipado with a Snapdragon 888 processor when observing clock speeds listed by Configuration fortnite Call Duty and Pubg are already available on furniture platforms and soon it will be APEX Leg,tech
315,8:30 pm DRAGAO WEEK WEEK NO FAIBLE OF FEATO TO THE BLUEs and WHITOR ROUNTED TO 'PLAY' OF ACCESS TO THE 'Oitaves' of the Europa League in the sequence of home defeat with Atletico Madrid 3 1 The Dragoes A,sports
3350,"Russia behaves this assuming a thoroughman in relation to its neighbors and this harms Europe's security ""pointed out judicial process moved by the Municipal Camara de Almada started with a t",general
2807,"several members in the discussion of Saturday night ended this mocao asked Il defense of ""individual freedom in times of peace in times of war in times of colleague in times of covid"" was there",general
465,M CARLOS Carvalhal wanted to count on all the players just like me but this is not possible and is part of the life of the coaches in the receck to the SC Braga room and after Sporting receive Bo,sports
240,ores' liverpool 37 and Chelsea 36 West Ham keeps himself in fourth place and in 'zone' of clearance to league of the champions with points but was no longer distant from that trio as he allowed MAN approxence,sports
2436,Men and women and more 35 of young MPLA leader re-elected with 98 04 of the votes also President of the Republic of Angola thanked commitment of the organization of Angolan woman's angry party and refusing,general
2079,and Christmas single until natalcomedia romantic movies lgbtq 1h41 min imdb 6 3 10peter asks the best friend to pretend to be your boyfriend while going to spend time christmas with angelanim Christmas family,tech
